{
  "id": "verifier__cross-checks__cc-noi-16-positive-disagrees__validate",
  "target": "verifier",
  "format_version": "3.0",
  "requires_capabilities": [
    "validate"
  ],
  "command": "validate",
  "args": [
    "deal.uwx.md",
    "--json"
  ],
  "fixture_dir": "conformance/cross-checks/cc-noi-16-positive-disagrees",
  "expect": {
    "kind": "json-subset",
    "file": "expected.json",
    "project": "issue-code-severity-set",
    "exit_code": 0
  }
}
