{
  "id": "verifier__property-cash-flow-assembly__boundary-acquisition-equal__verify-property-cash-flows",
  "target": "verifier",
  "format_version": "3.0",
  "requires_capabilities": [
    "parse",
    "verify-property-cash-flows"
  ],
  "command": "verify-property-cash-flows",
  "args": [
    "deal.uwx.md",
    "plan.json",
    "--json"
  ],
  "fixture_dir": "conformance/property-cash-flow-assembly/boundary-acquisition-equal",
  "expect": {
    "kind": "json-subset",
    "file": "expected.json",
    "project": "property-cash-flow-assembly",
    "exit_code": 1
  }
}
