{
  "id": "verifier__reserve-accounts__overflow__verify-reserve-accounts",
  "target": "verifier",
  "format_version": "3.0",
  "requires_capabilities": [
    "parse",
    "verify-reserve-accounts"
  ],
  "command": "verify-reserve-accounts",
  "args": [
    "deal.uwx.md",
    "--json"
  ],
  "fixture_dir": "conformance/reserve-accounts/overflow",
  "expect": {
    "kind": "json-subset",
    "file": "expected.json",
    "exit_code": 1
  }
}
