{
  "id": "verifier__metrics__statement-home-land-carry-noi-missing-opex__verify-metrics",
  "target": "verifier",
  "format_version": "3.0",
  "requires_capabilities": [
    "parse",
    "verify-metrics"
  ],
  "command": "verify-metrics",
  "args": [
    "deal.uwx.md",
    "--json"
  ],
  "fixture_dir": "conformance/runner/derived/metrics/statement-home-land-carry-noi-missing-opex",
  "expect": {
    "kind": "statement-states",
    "file": "conformance/metrics/statement-homes/cases.json",
    "baseline_pointer": "/cases/29",
    "exit_code": 0
  }
}
