{
  "id": "verifier__scenario__21-btr-class-scope__validate",
  "target": "verifier",
  "format_version": "3.0",
  "requires_capabilities": [
    "validate"
  ],
  "command": "validate",
  "args": [
    "deal.uwx.md",
    "--json"
  ],
  "fixture_dir": "conformance/scenario/21-btr-class-scope",
  "expect": {
    "kind": "json-subset",
    "file": "expected.json",
    "project": "issue-code-severity-set",
    "exit_code": 0
  }
}
