{
  "id": "verifier__reserve-draw-bindings__unclassified-movement__verify-reserve-draws",
  "target": "verifier",
  "format_version": "3.0",
  "requires_capabilities": [
    "parse",
    "calc-evaluate"
  ],
  "command": "verify-reserve-draws",
  "args": [
    "deal.uwx.md",
    "plan.json",
    "--json"
  ],
  "fixture_dir": "conformance/reserve-draw-bindings/unclassified-movement",
  "expect": {
    "kind": "json-subset",
    "file": "expected.json",
    "exit_code": 1
  }
}
