{
  "id": "verifier__calc__period-01-year-order__calc",
  "target": "verifier",
  "format_version": "3.0",
  "requires_capabilities": [
    "calc-evaluate"
  ],
  "command": "calc",
  "args": [
    "deal.uwx.md",
    "calc.json",
    "--json"
  ],
  "fixture_dir": "conformance/calc/fixtures/period-01-year-order",
  "expect": {
    "kind": "json-subset",
    "file": "expected-result.json",
    "exit_code": 0
  }
}
