{
  "id": "starter-products__documents__05-land-stage-overlay__render-summary",
  "target": "starter-products",
  "format_version": "3.0",
  "requires_capabilities": [
    "render-summary"
  ],
  "command": "render",
  "args": [
    "05-land-stage-overlay.uwx.md",
    "--format",
    "summary"
  ],
  "fixture_dir": "conformance/documents/fixtures",
  "expect": {
    "kind": "text",
    "file": "conformance/documents/expected/05-land-stage-overlay.rendered-summary.md",
    "baseline_field": "content"
  }
}
